{
  "id": "016-next-shadcn-frontend-redesign",
  "title": "Redo front end with Next.js and shadcn",
  "branch": "agent/016-next-shadcn-frontend-redesign",
  "priority": 16,
  "status": "passed",
  "lane": "frontend",
  "allowed_paths": [
    ".agent/queue",
    ".agent/reports",
    ".gitignore",
    "README.md",
    "app.js",
    "components.json",
    "docs",
    "eslint.config.mjs",
    "index.html",
    "next-env.d.ts",
    "next.config.ts",
    "package-lock.json",
    "package.json",
    "postcss.config.mjs",
    "scripts",
    "src",
    "styles.css",
    "tests",
    "tsconfig.json",
    "vercel.json"
  ],
  "forbidden_paths": [".git", "node_modules", ".env", ".vercel/project.json"],
  "goal": "Replace the static worksheet library front end with a Next.js App Router, TypeScript, Tailwind, and shadcn/ui teacher console while preserving deterministic worksheet generation and answer checking.",
  "context": "The user explicitly chose a Next + shadcn rebuild, a teacher-console aesthetic, and a full JavaScript rewrite. Worksheet JSON remains the source of truth for preview, answer keys, checking, print rendering, and future exports.",
  "acceptance": [
    "Next.js App Router, TypeScript, Tailwind, shadcn configuration, and npm scripts are present",
    "The root experience is a dense light teacher console with search, exact grade, strand, format filters, generator selection, settings, live preview, answer audit, answer checking, and print-safe output",
    "Worksheet generation returns canonical Worksheet JSON and uses it as the source for preview, answer key, checking, and print rendering",
    "Typed helpers exist for filtering worksheet types, generating worksheets, auditing worksheets, and checking answers",
    "Generator verification covers every worksheet type and passes",
    "Static index.html, app.js, and styles.css are retired so there is not a second frontend system",
    "Vercel and README documentation reflect the Next.js deployment path"
  ],
  "commands": [
    "node scripts/agent-validate.mjs",
    "node tests/fixtures/validate-fixtures.mjs",
    "npm run lint",
    "npm run typecheck",
    "npm run test",
    "npm run test:generators",
    "npm run build"
  ],
  "max_attempts": 2,
  "depends_on": ["002-schema-and-fixtures", "003-test-harness"],
  "notes": "Do not add auth, accounts, databases, payments, LMS integration, OCR, serverless APIs, custom PDF generation, or non-JSON worksheet content paths."
}
